title,post
How is DCA in s&p500 such a superior strategy compared to other strategies around s&p500 investments?,"Hello,

So what I did was, take daily data of s&p500 for last 10 years.

In scenario #1, I did plain DCA. 1st of every month, I put 1k in s&p500

In scenario #2, **along with DCA**, I also added to my portfolio any time s&p500 fell 5%, 10%, 15% from peak.

Returns in scenario #2 were lower than #1. This sounds really counter intuitive. Can someone explain why? How does buying the dips not help especially over 10 years?"
These are the stocks on my watchlist (11/26),"# I'm back.

Hi! I am an ex-prop shop equity trader.

This is a daily watchlist for trading: I might trade all/none of the stocks listed, and even stocks not listed! I only hold some/all MAG 7 stocks and market indices long-term. If you use Old Reddit, click “Show Images” at the top to expand the charts. Any positions stated aren’t recommendations, I’m following subreddit rules to disclose positions. I use IBKR TWS for my platform and charts.

I am targeting potentially good candidates to day trade; I have no opinion on them as investments. This means the potential of the stock moving today is what makes it interesting, not the business, long-term prospects, or the people involved.

PLEASE ask specific questions and PLEASE don’t ask about earnings because I typically don’t take positions before earnings announcements. Questions like “Thoughts on \_\_\_\_\_?” or “Why isn’t \_\_\_ on the watchlist?” or something answered already will be ignored unless you add detail and your opinion.  If you post a question and delete it after I answer it, I will block you- doing that hurts discussion. I am not answering questions if I’m still long or short a stock beyond what I update.

Tariffs are the biggest news today, 25% on Canada/Mexico and 35% on China.

News: [Trump Vows To Hit China Mexico Canada With Tariffs Over Border](https://www.bloomberg.com/news/articles/2024-11-25/trump-vows-to-hit-china-mexico-canada-with-tariffs-over-border)

[**SPY**](https://finviz.com/quote.ashx?t=SPY&p=d)/[**VXX**](https://finviz.com/quote.ashx?t=VIX&p=d)/[**QQQ**](https://finviz.com/quote.ashx?t=QQQ&p=d) \- Watching major market indices on the tariff news. Obviously, keeping an eye peeled for Trump's Twitter and other potentially market moving news.

[**MSTR**](https://finviz.com/quote.ashx?t=MSTR&p=d) \- Broke $400 yesterday, no bias yet but still watching. Will likely be the last day on the watchlist.

[**TSLA**](https://finviz.com/quote.ashx?t=TSLA&p=d) \- Drops yesterday on news of possible exclusion from California's EV Tax credits. Still interested to see if we can break the highs of the stock ($363.)

[**ZM**](https://finviz.com/quote.ashx?t=ZM&p=d) \- EPS of $1.38 vs $1.31 expected. Revenue of $1.18B v $1.16B expected. Beat guidance expectations of well, and cited release of a premium custom AI companion that can connect to WorkDay and ServiceNow.

**IONQ**\- Most of the quantum computing stocks have been on a tear lately, been interested in both the parabolic and larger names.

[**RIVN**](https://finviz.com/quote.ashx?t=RIVN&p=d)**-** Receives conditional $6.6B loan, watching the $13 level.

Earnings: [**DELL**](https://finviz.com/quote.ashx?t=DELL&p=d), [**CRWD**](https://finviz.com/quote.ashx?t=CRWD&p=d), [**WDAY**](https://finviz.com/quote.ashx?t=WDAY&p=d), [**ADSK**](https://finviz.com/quote.ashx?t=ADSK&p=d)"
"r/Stocks Daily Discussion & Technicals Tuesday - Nov 26, 2024","This is the daily discussion, so anything stocks related is fine, but the theme for today is on technical analysis (TA), but if TA is not your thing then just ignore the theme.

Some helpful day to day links, including news:

* [Finviz](https://finviz.com/quote.ashx?t=spy) for charts, fundamentals, and aggregated news on individual stocks
* [Bloomberg market news](https://www.bloomberg.com/markets)
* StreetInsider news:
  * [Market Check](https://www.streetinsider.com/Market+Check) - Possibly why the market is doing what it's doing including sudden spikes/dips
  * [Reuters aggregated](https://www.streetinsider.com/Reuters) - Global news

-----

**Technical analysis (TA)** uses historical price movements, real time data, indicators based on math and/or statistics, and charts; all of which help **measure the trajectory of a security.**  TA can also be used to interpret the actions of other market participants and predict their actions.
        
The main benefit to TA is that everything shows up in the price (commonly known as **""priced in""**):  All news, investor sentiment, and changes to fundamentals are reflected in a security's price.

TA can be useful on any timeframe, both short and long term.

Intro to technical analysis by [Stockcharts chartschool](https://stockcharts.com/school/doku.php?id=chart_school:technical_indicators:introduction_to_technical_indicators_and_oscillators#benefits_and_drawbacks_of_leading_indicators) and their [article on candlesticks](https://stockcharts.com/school/doku.php?id=chart_school:chart_analysis:introduction_to_candlesticks)

If you have questions, please see the following word cloud and click through for the wiki:

[Indicator - Trade Signals - Lagging Indicator - Leading Indicator - Oversold - Overbought - Divergence - Whipsaw - Resistance - Support - Breakout/Breakdown - Alerts - Trend line - Market Participants - Moving average - RSI - VWAP - MACD - ATR - Bollinger Bands - Ichimoku clouds - Methods - Trend Following - Fading - Channels - Patterns - Pivots](https://www.reddit.com/r/stocks/wiki/ta-themed-post)

See our past [daily discussions here.](https://www.reddit.com/r/stocks/search?q=author%3Aautomoderator+%22r%2Fstocks+daily+discussion%22&restrict_sr=on&sort=new&t=all)  Also links for:  [Technicals](https://www.reddit.com/r/stocks/search?q=author%3Aautomoderator+title%3Atechnicals&restrict_sr=on&include_over_18=on&sort=new&t=all) Tuesday, [Options Trading](https://www.reddit.com/r/stocks/search?q=author%3Aautomoderator+title%3Aoptions&restrict_sr=on&include_over_18=on&sort=new&t=all) Thursday, and [Fundamentals](https://www.reddit.com/r/stocks/search?q=author%3Aautomoderator+title%3Afundamentals&restrict_sr=on&include_over_18=on&sort=new&t=all) Friday."
Rivian Receives Conditional Commitment for up to $6.6 Billion Loan from the U.S. Department of Energy,"RVINE, Calif., November 26, 2024--(BUSINESS WIRE)--American all-electric automaker Rivian Automotive (NASDAQ: RIVN) today announced it has received conditional commitment from the U.S. Department of Energy’s Advanced Technology Vehicle Manufacturing (ATVM) Loan Program for a loan of up to $6.6 billion (including $6 billion of principal and approximately $600 million of capitalized interest) to accelerate its growth and leadership of electric vehicle design, development and manufacturing in the United States.

If finalized, the loan would support the construction of Rivian’s next facility in Stanton Springs North, near the city of Social Circle, Georgia, substantially expanding the company’s domestic production capacity to support demand from the United States and international markets. This loan from DOE would provide significant funding for production of the company’s midsize platform, which underpins the R2, a midsize SUV, and the R3/R3X, a midsize crossover. Designed, engineered, and built in America to deliver an incredible combination of capability, function, performance, and pricing, Rivian believes its R2 and R3 vehicle lines will be critical drivers in the company’s long-term growth and profitability.

The DOE loan would provide an important boost to the U.S. automotive industrial base, enabling significant job creation and investment that is important for the United States to maintain its leadership as electric vehicles become a strategically important industry.

Rivian intends to build the facility in two phases, each resulting in 200,000 units of annual production capacity, for a total of 400,000 units of annual capacity–supporting the sale of American EVs in international markets. Phase 1 of the project is expected to start production in 2028. Rivian is expected to create approximately 7,500 operations jobs through 2030 at the company’s future manufacturing facility in Georgia. This is in addition to 2,000 expected full-time construction jobs that will utilize the region’s significant talent and workforce to further strengthen the domestic EV ecosystem. These jobs complement the thousands Rivian has already created and plans to maintain at its current plant in Normal, Illinois, which have bolstered the local and regional economy.

""This loan will help create thousands of new American jobs and further strengthen U.S. leadership in EV manufacturing and technology,"" said Rivian Founder and CEO RJ Scaringe. ""This loan would enable Rivian to more aggressively scale our U.S. manufacturing footprint for our competitively priced R2 and R3 vehicles that emphasize both capability and affordability. A robust ecosystem of U.S. companies developing and manufacturing EVs is critical for the U.S. to maintain its long-term leadership in transportation.""

Rivian plans to design and build a fully modern manufacturing facility at the Stanton Springs Site, less than one hour’s drive from downtown Atlanta, employing modern construction techniques and advanced environmental management while preserving natural spaces and investing actively in the surrounding communities.

Over the history of the loan program, DOE has helped energize American EV manufacturing with billions in financing for this strategically important industry, including loans to General Motors and Tesla.

While this conditional commitment indicates DOE’s intent to finance the project, DOE and the company must satisfy certain technical, legal, environmental, and financial conditions before the Department of Energy enters into definitive financing documents and funds the loan. If finalized, the loan would be secured by all assets of the project and fixed assets and guarantees of the parent company, Rivian Automotive, Inc. and certain of its subsidiaries.

Forward-looking Statements

This press release contains forward-looking statements within the meaning of the Private Securities Litigation Reform Act of 1995. We intend such forward- looking statements to be covered by the safe harbor provisions for forward-looking statements contained in Section 27A of the Securities Act of 1933, as amended, and Section 21E of the Securities Exchange Act of 1934, as amended. All statements contained in this press release that do not relate to matters of historical fact should be considered forward-looking statements, including without limitation statements regarding the final approval, the use of proceeds, and the expected impact of the DOE loan, you can identify forward-looking statements by terms such as ""may,"" ""will,"" ""should,"" ""expects,"" ""plans,"" ""anticipates,"" ""could,"" ""intends,"" ""targets,"" ""projects,"" ""contemplates,"" ""believes,"" ""estimates,"" ""forecasts,"" ""predicts,"" ""potential"" or ""continue"" or the negative of these terms or other similar expressions, although not all forward-looking statements use these words or expressions. We have based these forward-looking statements largely on our current expectations and projections about future events and financial trends that we believe may affect our business, financial condition, and results of operations. Forward-looking statements involve known and unknown risks, uncertainties and other important factors that may cause our actual results, performance, or achievements to be materially different from any future results, performance, or achievements expressed or implied by the forward-looking statements, including, but not limited to, the important factors discussed in Part II, Item 1A, ""Risk Factors"" in Rivian’s Quarterly Report on Form 10-Q for the quarter ended September 30, 2024, and its other filings with the Securities and Exchange Commission. The forward-looking statements in this press release are based upon information available to us as of the date of this press release, and while we believe such information forms a reasonable basis for such statements, such information may be limited or incomplete, and our statements should not be read to indicate that we have conducted an exhaustive inquiry into, or review of, all potentially available relevant information. These statements are inherently uncertain, and investors are cautioned not to unduly rely upon these statements. While we may elect to update such forward-looking statements at some point in the future, we disclaim any obligation to do so, even if subsequent events cause our views to change.

About Rivian

Rivian (NASDAQ: RIVN) is an American automotive manufacturer that develops and builds category-defining electric vehicles and accessories. The company creates innovative and technologically advanced products that are designed to excel at work and play with the goal of accelerating the global transition to zero-emission transportation and energy. Rivian vehicles are built in the United States and are sold directly to consumer and commercial customers. The company provides a full suite of services that address the entire lifecycle of the vehicle and stay true to its mission to keep the world adventurous forever. Whether taking families on new adventures or electrifying fleets at scale, Rivian vehicles all share a common goal — preserving the natural world for generations to come."
TIL You can invest in SpaceX and Xai -- but you have to do it via Cathy Woods & SoFi,"Cathy Wood's Venture Fund, ArkVX holds companies like:

* SpaceX (12%)
* X.ai (1.5%)
* Epic Games (5.5%)
* Open.AI (5.29%)

The catch is the only place you can buy ArkVX is through the SoFi app. My question is:

* How long is this exclusive deal going to last? 
* If you're using SoFi or have considered it, do you like their platform?"
"California plan excludes Tesla from new EV tax credits, governor's office says","Tesla's electric vehicles likely would not qualify for California's new state tax credits under a proposal in the works if President-elect Donald Trump scraps the federal tax credit for EV purchases, Governor Gavin Newsom's office said on Monday.
Tesla shares closed down 4%.

Trump's transition team is considering eliminating the federal tax credit of $7,500 for EV purchases, Reuters reported this month.

Tesla CEO Elon Musk, a close Trump adviser, sharply criticized the idea of barring the automaker from EV subsidies writing on X in response ""Even though Tesla is the only company who manufactures their EVs in California! This is insane.""

Musk has said he supports ending subsidies for EVs, oil and gas.

Newsom said on Monday that if Trump eliminates a federal EV tax credit, he will propose creating a new version of the state’s Clean Vehicle Rebate Program that ended in 2023 and spent $1.49 billion to subsidize more than 594,000 vehicles.

""The governor’s proposal for ZEV rebates, and any potential market cap, is subject to negotiation with the legislature. Any potential market cap would be intended to foster market competition, innovation and to support new market entrants,"" the office said.

California provided up to $7,500 for the purchase or lease of a new plug-in hybrid, battery or fuel cell EV and could potentially be paid for by the Greenhouse Gas Reduction Fund which is funded by polluters under the state's cap-and-trade program.

Musk and Newsom have clashed over state policies such as shutting Tesla's Fremont factory during the pandemic and California's approval of a bill on transgender kids.

In 2021, Tesla moved its headquarters from California to Texas, and Musk said this year that his other companies such as SpaceX and social media platform X will follow suit.

California has crossed the 2 million mark for sales of zero-emission vehicles, doubling total sales since 2022.

Last month, a California official said he expects the Environmental Protection Agency to approve the state's plan to halt the sale of gasoline-only vehicles by 2035, a proposal that major automakers have met with skepticism.
California's rules, which have been adopted by a dozen other states, require 80% of all new vehicles sold in the state be electric by 2035 and no more than 20% plug-in hybrid electric.

Source: https://www.reuters.com/business/autos-transportation/california-governor-newsom-propose-clean-vehicle-rebate-if-trump-cuts-ev-tax-2024-11-25/"
What’s your plan for Dec / 2025?,"I just want to gauge sentiment and what people are looking at for end of this year and start of next. 

I think most of us are sitting on some capital gains but I’m thinking of doing some selling around Christmas as I hope we get a year end rally. 

My general plan is to sit on cash as we go into next year and policies play out - I personally think tariffs will make inflation go back up so maybe looking at hedges against that. 

"
Zenas Biopharma (ZBIO),"High risk high reward

I usually avoid biopharma companies like the plague, however this gem came across my radar. Their flagship drug obexelimab is currently in its phase 3 trials for IgG4 related diseases. The drug is also in phase 2 trials for other autoimmune diseases. They are expected to complete their phase 3 trials in 2026. The current data from the phase 2 trials seems promising. Current drugs on the market for these diseases bring in around 10B a year in revenue. The companies current market cap is 460M and the company as a book value circa 350M. If you fire up open insider you can see the CEO and directors are purchasing. This would be a long term play as you would have to at least wait out phase 3 trial results, but if approved we could be looking at a potential 10 bagger."
Question on Oil Companies,"I'm considering investing in EcoPetrol and I saw a commenter post this stat:

Ecopetrol proven reserves: 1.9 billion barrels

Petrobras proven reserves: 10.9 billion barrels.

Ecopetrol breakeven price: $36 per barrel

Petrobras breakeven price: $20 per barrel

My question is, how is it that most years Ecopetrol stays profitable when it costs them 80% more to breakeven? They have been profitable most years and still gain lots of venue, how can petrobas not just lower prices, remain profitable and chase them out? What is keeping Ecopetrol around in this situation?"
Why MicroStrategy Stock Rocketed 24.7% Higher This Week,"MicroStrategy has been the talk of YouTube lately with most posters being very bullish.  This article presents a slightly bearish case.

[Article link:](https://finance.yahoo.com/news/why-microstrategy-stock-rocketed-24-001809810.html)

# Article Summary:

* Stock Surge: MicroStrategy’s stock rose by 24.7% this week, driven by Bitcoin’s price increase and a new convertible debt offering.
* Bitcoin Holdings: The company now holds 279,420 Bitcoins, benefiting from Bitcoin’s 10% price rise this week.
* Convertible Debt: MicroStrategy issued a $3 billion convertible note with a 0% interest rate, due in 2029, allowing them to buy more Bitcoin1.
* Investment Advice: Despite the attractive financing, the article suggests that buying MicroStrategy stock at its current high valuation may not be wise for long-term investors."
"r/Stocks Daily Discussion Monday - Nov 25, 2024","These daily discussions run from Monday to Friday including during our themed posts.

Some helpful links:

* [Finviz](https://finviz.com/quote.ashx?t=spy) for charts, fundamentals, and aggregated news on individual stocks
* [Bloomberg market news](https://www.bloomberg.com/markets)
* StreetInsider news:
  * [Market Check](https://www.streetinsider.com/Market+Check) - Possibly why the market is doing what it's doing including sudden spikes/dips
  * [Reuters aggregated](https://www.streetinsider.com/Reuters) - Global news

If you have a basic question, for example ""what is EPS,"" then google ""investopedia EPS"" and click the investopedia article on it; do this for everything until you have a more in depth question or just want to share what you learned.

Please discuss your portfolios in the [Rate My Portfolio sticky.](https://www.reddit.com/r/stocks/search?q=author%3Aautomoderator+title%3A%22Rate+My+Portfolio%22&restrict_sr=on&sort=new&t=all).

See our past [daily discussions here.](https://www.reddit.com/r/stocks/search?q=author%3Aautomoderator+%22r%2Fstocks+daily+discussion%22&restrict_sr=on&sort=new&t=all)  Also links for:  [Technicals](https://www.reddit.com/r/stocks/search?q=author%3Aautomoderator+title%3Atechnicals&restrict_sr=on&include_over_18=on&sort=new&t=all) Tuesday, [Options Trading](https://www.reddit.com/r/stocks/search?q=author%3Aautomoderator+title%3Aoptions&restrict_sr=on&include_over_18=on&sort=new&t=all) Thursday, and [Fundamentals](https://www.reddit.com/r/stocks/search?q=author%3Aautomoderator+title%3Afundamentals&restrict_sr=on&include_over_18=on&sort=new&t=all) Friday."
