title,post
Manchester United stock (NYSE: MANU) – potential to grow,"According to Forbes magazine Manchester United is the second most valuable club in football, only behind Real Madrid. Only Real Madrid and Barcelona have more fans in the world. This is despite the fact that last major trophy they won is Premier League in 2013.  This was the last season with Sir Alex Ferguson at the helm – he is the best manager in history of this club. He retired and since then they are struggling a lot and underperforming. Last season they finished 8^(th) in the Premier League, this season they are 13^(th). Disappointment. They play in Europa League, second tier competition in Europe. The real money is in Champions League.

They have a tremendous potential. Big history, a lot of fans, a lot of money. They should compete for the most important throphies every year. But they didn’t in previous years and fans are angry about that.

Things are subject to change though. At the end of 2023 Sir James Ratcliffe bought 25% of club’s shares. He is the fan of the club and he has a lot to say about how the club is run. He is committed to rebuilding club and bring back glory the club aspire to. On January 2024 Omar Berrada was appointed as new CEO of the club, chief executive officer. He joined United after 13 years spent in Manchester City that was the most successful club in England during this period. On July 2024 Dan Ashworth started to work as sporting director. He worked for Newcastle and Brighton previously. He did a really god job there. In Brighton under his watch they transferred in Caicedo, Mac Allister, Cucurella, Mitoma and Trossard, they sold them later for more money. In Newcastle he was in charged when they bought Isak, Gordon, Barnes, Tonali and Botman. Great business. Recently they hired Ruben Amorim, who was successful in Sporting Lisboa. In the summer he was considered as new Liverpool FC manager, eventually they decided to go with Arne Slot who is excellent in his new role.

The future for Manchester United is bright. They have a competent people running the club. Ruben Amorim is one of the best of young managers in the world and seems to be a really good pick who is able to transform the whole club like Jurgen Klopp did it at Liverpool in the last decade. He needs time but he seems to be capable of making Manchester United great again. They were underperforming in the last 10 years but finally they addressed the issues and should be performing better. They need a time, of course, to build strong team. The thing is – if they perform on the pitch, they earn more money. I believe it is the matter of time before they are on the top. And when they reach this level, when they compete amongst really the best, their stock price should be much higher than it is now.

I think they will be a strong again very soon, they will compete and good performance on the pitch will result with big amount of cash going to the club. The next 10 years should be much better than the last 10 years. Currently their stock price is 17,47 USD. They certainly has potential for more. One more reason is – there are more and more money in football every year so this is another factor in favor of this stock.

I think that this club will compete for Premier League and Champions League in 2-4 years and it should have a huge impact on their finances. My opinion is this stock has potential to grow. Am I wrong? What do you think? I am new in the stock market so maybe I am missing something."
"After being wrong about MBLY, BOFA doubles down: ""BofA Securities Trims Mobileye Global Price Target to $12 From $13""","Max pain for options on MBLY is misleading when we have over 20% of the float shorted and underwater, the smart ones closed when it was sold off, and then some trading professionals such as BOFA securities/their-friends/people-who listen-to-them, likely opened new shorts at the bottom and tried convincing others to follow their lead.

Then as we would usually see analysts revise their predictions after the market moves (especially if they called it wrong), to make it seem they are smart or something, BOFA securities revised their predictions, to be even more wrong, showing that they are doubling down on their/people-who-listen-to-theirtrading-advice shorts and are willing to be in denial on a stock even if the market decides they are wrong.

Its not the end of the world to have entrenched shorts, since at the end of the day their losses are unlimited, and when they do close its more capital injected, the longer they waited.

Source: https://www.marketbeat.com/stocks/NASDAQ/MBLY/short-interest/"
Are we putting too much faith in generative AI? Could this hurt AI investments more broadly?,"Obviously a lot of money is being made off of AI-related stocks. I'm not one of those lucky investors. Part of the reason is that I fear we're not in a general AI bubble, as many have discussed, but rather a *generative AI* bubble. I'd appreciate hearing how others feel about this.

Right now, by far the bulk of investment is focused on generative AI (especially LLMs), with NVDA at or very near the center of it all, thanks to its GPUs. Meanwhile, alternative AI approaches (e.g., neuromorphic computing, symbolic AI, reinforcement learning, and hybrid models) have been getting far less attention.

The problem? As impressive as it may seem, generative AI has some significant (and inherent) drawbacks:

* Factually unreliable outputs (it can’t reliably distinguish fact from fiction)
* Probabilistic reasoning (no true causal understanding)
* High computational costs (questionable sustainability)
* Limited real-world problem-solving abilities

At some point, the reality of generative AI's limitations will become apparent enough to investors that we could see an AI market correction or even collapse. This would not only hurt AI stocks like NVDA, but it could also starve funding for alternative AI approaches that have long-term potential yet have been largely overlooked.

What do you think? How is this influencing your investment decisions?"
Before P.Diddy We Had Wynn - Do You Think Wynn Resorts Can Recover From the Scandal?,"Hey guys, in 2018, sexual misconduct allegations against its CEO, Steve Wynn, led to his resignation, ruined Wynn Resorts’s reputation, and also caused an 18% stock drop, here is the full story: [https://www.benzinga.com/markets/24/11/42050388/high-stakes-and-higher-scandals-inside-wynn-resorts-legal-and-ethical-crisis](https://www.benzinga.com/markets/24/11/42050388/high-stakes-and-higher-scandals-inside-wynn-resorts-legal-and-ethical-crisis) 

So.. do you know about Wynn Resorts? Did you ever invest in it? Do you think they will recover at some point?"
"FAA Green Light, $6B Orders, Stellantis Millions: Archer Aviation's $5M Flying Taxis may be the Tesla of the Sky","ACHR isn't just another eVTOL play. They are literally building the future of transportation while everyone else is still drawing pictures.

Their manufacturing facility will be completed in weeks. They have received a [$400M backing from Stellantis](https://beyondspx.com/article/archer-aviation-pioneering-the-future-of-electric-aviation) for production. This is not some vaporware - they have real manufacturing power. The company will pump out 650 aircraft yearly. That translates to billions in revenue when each Midnight sells for $5M+.

Regarding FAA certification, they have [already nailed Phase 3 of 4](https://finance.yahoo.com/news/archer-announces-third-quarter-2024-210500611.html). While other companies are still figuring out how to get off the ground, ACHR has already obtained their Part 135 certificate. They are ready to operate the moment they receive final approval.

Their international expansion is moving at an incredible pace. A [massive UAE deal is coming in Q4 2025](https://finance.yahoo.com/news/archer-hires-uae-leader-abu-050000552.html). They have just secured the UAE's top aviation regulator. Additionally, they have a [Japan Airlines partnership locked in](https://finance.yahoo.com/news/japan-airlines-sumitomo-corporation-joint-venture-130000670.html), which includes a $500M aircraft order. Their order book has now reached $6B+ with actual orders and deposits.

The most compelling aspect is that they have $500M cash on hand. They are burning far less capital than their competitors. With a big auto partnership, upcoming FAA approval, global expansion, and a first-mover advantage in a trillion-dollar market, this is not some penny stock moonshot. They are positioned as the next Tesla of the skies. The infrastructure is ready, regulations are green-lit, and wealthy individuals are eager for flying taxis. The numbers speak for themselves. But, perhaps I am too optomistic - I'd love to hear your thoughts."
Which sector etf would be a good hedge against inflation?,"Would the usual safe havens, like utilities, health care, gold, still do well with inflation? Or will health care fall off because of the rnd cost is too high, and rnd stops? Will utilities get hit by more storms/ freak weather events and become unprofitable? I guess food is gonna be volatile if the migrant workers leave. Gold will probably come down again if the war in Ukraine ends"
Zeta global short attack,"Hi, I've been following ZETA global for quite while now. It has recently suffered a 50% blow to its SP due to not good enough earnings followed by a report from short seller ""Culper research"".
 I won't go into details of thier report, but after reading it I believe it is of very low quality (they even got the ZETAs auditor wrong lol).

After the decline of the price I was tempted to start building a position, especially since the SP was starting to recover. However, today in PM the shares are going back to around 20$. Another short seller (Lauren Balik) has published a report. To me it once again seems like a blatant attempt of trying to lower the price. It is overblown and full of speculation. She also published similiar articles on NVDA, APP, SNOW. But the market is dumping anyway.

My question is - how likely is it going to actually hurt the company long term? Is it too risky to enter now? Do you know of some other companies targeted by mulriple short sellers In the past (I would like to examine how they did or did not recover)?

"
C3AI begins to turn the tide,"C3.ai shares jumped 25% in a single day on the announcement of a deeper partnership with Microsoft. The new agreement clarifies Microsoft Azure as C3.ai's preferred cloud services platform and C3.ai's AI applications as Azure's preferred enterprise solutions. Although the two have been working together since 2018, this announcement pushes the market's focus on its AI potential higher.

Underestimated potential: c3.ai's revenue grew 21% in the quarter and is expected to grow 24% going forward. Current market capitalization is \~$4 billion and trades at a multiple of 11x its FY2025 revenue target.

Pilots: The company has 224 pilots, 85% of which are active, representing a 117% year-over-year increase in the number of pilots. 70% of pilots are expected to be converted into formal contracts.

Future Potential: Revenues are expected to pick up to 30% from current growth rates through pilots to formal deals. 2026 FY projected revenue target is $462 million, with a share price potential of up to $36 if it reaches an 8x EV/revenue valuation.

While the partnership has boosted market enthusiasm, I would wait for market sentiment to pull back before getting in. In addition, the conversion of pilots to full-fledged programs is key to future growth.



[C3.ai](http://C3.ai) will release its latest earnings report on Dec. 9, so watch for sales growth and pilot conversion to further assess its potential."
Thoughts on building a 10Y high risk portfolio,"Over the past few years I’ve built a portfolio consisting of S&P, Apple, Meta, Amazon, Microsoft, JPM and BRK. It has done rather well, consistently giving returns of 25%+ annually (except 2022). 

However in recent times my conviction on adding more capital to this portfolio has waned. I just feel the best days in terms of returns for some of the big tech groups may not be what they were for the past decade.

I could 100% be wrong and there is no doubt there is certain bias seeing the return of my smaller positions this year dwarfing the ones of the traditional blue chip guys if you will.

So saying all this I’m considering: 

50% S&P

10% Hood

10% Rddt

10% Rolls Royce

10% Cava

5% Lunr

5% ASTS

Quick rationale for each:

Hood: Expanding to Europe and offering very exciting new products like Hood Gold 

Rddt: Fastest growing social media, ARPU and monetisation only getting better and seeing many more people using

Rolls Royce: Slight European exposure, building low cost Nuclear plants and capturing the wide body aircraft market

Cava: Fantastic management, strong customer retention and expected to double stores in next 5 years

Lunr & ASTS: Moonshot (literally), this is just in case space works out and much more speculative 



So having said all that, what is everyone’s thoughts on this proposed portfolio allocation. Is this too risky, not enough diversification into the different sectors? Any thoughts and opinions on this would be great!"
Thoughts and dilemma on Rocket Lab? ,"I went into Rocket Lab back in July with the intention of making it my primary long-term growth stock and since then have managed to acquire 440 shares at average price of around $9.  

My intention was/is to keep buying and hold the stock for many many years, because I truly believe in the company potential and the overall space industry and I believe that it will be a key growth sector for the next decade and beyond regardless of who is in power in the US. (I am not american btw)

Just before the election I was in profit in the low thousands, which was nice but since the election I am now sitting at a profit of 147%, which is my best position in my investing ""career"" so far. 

Like I said, I believe the company will do well regardless of who is in power. However, given the fast rise since the election I am expecting correction happening soon. 

And my dilemma is: should exit now and take the profits and then go back in after the correction? Or should I just hold until the potential correction and start buying more then? 

What would you do in my situation?"
What I learnt from MSTR frenzy,"I have been a long term investor in MSTR, in fact buying  my position Pre-split.  
My thesis was very much connected to an alternative investment vehicle into Bitcoin.  Even though I have BTC as a holding in my crypto, I was more after exposure in an equity portfolio.

To cut a long story short, I bought it when it was no mainstream and no ETF's were existing.

I must admit, I sat on a loss for about one year in MSTR.  Buying at $48.10 (split adjusted), and for the longest time sitting at the $25-$30 range, BTC was consolidating and I was fine with that.

If people understand what MSTR are doing, this playbook with bonds and hedging BTC was already in play for a long time, I was lucky enough to understand this quite early and and bought it quite early.  The difference being now that BTC is on a breakout and other companies are now looking into this method as well, the eyes on MSTR has multiplied exponentially .

Fast forward one year, and and the FOMO crowd arrived, and with that volatility.

Here is what I learnt when the FOMO arrived:

1. The stock is no longer trading on anything but emotion and speculation.
2. Valuations do not matter anymore.  The premium on BTC was as low as 1.5 less than one year go, reaching a peak earlier this week at 3.5
3. The stock goes up like crazy, and comes down like crazy, and when this happens, it's time to exit as there is nothing that is in your control.
4. There is so much manipulation (e.g. the citron report, Social media, Mainstream coverage), on what... a damn tweet!  it is not really easy to understand how this will move, so at this point it is just gambling.

I held my position up to the $543 level, and eventually my stop losses triggered yesterday around the $500 level.  So after 1.5 years, I am out of the MSTR trade.

The lesson I learnt is when the crowds arrive, turn round and walk away.

I still believe in the MSTR playbook, but will only come back when I am at the front of the queue buying at a negotiated price not when I am in a bidding war with gamblers."
"r/Stocks Daily Discussion & Fundamentals Friday Nov 22, 2024","This is the daily discussion, so anything stocks related is fine, but the theme for today is on fundamentals, but if fundamentals aren't your thing then just ignore the theme.

Some helpful day to day links, including news:

* [Finviz](https://finviz.com/quote.ashx?t=spy) for charts, fundamentals, and aggregated news on individual stocks
* [Bloomberg market news](https://www.bloomberg.com/markets)
* StreetInsider news:
  * [Market Check](https://www.streetinsider.com/Market+Check) - Possibly why the market is doing what it's doing including sudden spikes/dips
  * [Reuters aggregated](https://www.streetinsider.com/Reuters) - Global news

-----

Most fundamentals are updated every 3 months due to the fact that corporations release earnings reports every quarter, so traders are always speculating at what those earnings will say, and investors may change the size of their holdings based on those reports.

Expect a lot of volatility around earnings, but it usually doesn't matter if you're holding long term, but keep in mind the importance of earnings reports because a trend of declining earnings or a decline in some other fundamental will drive the stock down over the long term as well.

But growth stocks don't rely so much on EPS or revenue as long as they beat some other metric like subscriber count:  Going from 1 million to 10 million subscribers means more revenue in the future.

Value stocks do rely on earnings reports, investors look for wall street expectations to be beaten on both EPS & revenue.  You'll also find value stocks pay dividends, but never invest in a company solely for its dividend.


See the following word cloud and click through for the wiki:

[Market Cap - Shares Outstanding - Volume - Dividend - EPS - P/E Ratio - EPS Q/Q - PEG - Sales Q/Q - Return on Assets (ROA) - Return on Equity (ROE) - BETA - SMA - quarterly earnings](https://www.reddit.com/r/stocks/wiki/fundamentals-themed-post)

If you have a basic question, for example ""what is EBITDA,"" then google ""investopedia EBITDA"" and click the Investopedia article on it; do this for everything until you have a more in depth question or just want to share what you learned.

Useful links:

* [Investopedia page](https://www.investopedia.com/fundamental-analysis-4689757/) on fundamental analysis including [Discounted Cash Flow](https://www.investopedia.com/university/dcf/) analysis; see [definition here](https://www.investopedia.com/terms/d/dcf.asp) and read [their PDF on the topic.](http://i.investopedia.com/inv/pdf/tutorials/fundamentalanalysis_intro.pdf)
* [FINVIZ](https://finviz.com/quote.ashx?t=aapl) for fundamental data, charts, and aggregated news
* [Earnings Whisper](https://www.earningswhispers.com/stocks/aapl) for earnings details

See our past [daily discussions here.](https://www.reddit.com/r/stocks/search?q=author%3Aautomoderator+%22r%2Fstocks+daily+discussion%22&restrict_sr=on&sort=new&t=all)  Also links for:  [Technicals](https://www.reddit.com/r/stocks/search?q=author%3Aautomoderator+title%3Atechnicals&restrict_sr=on&include_over_18=on&sort=new&t=all) Tuesday, [Options Trading](https://www.reddit.com/r/stocks/search?q=author%3Aautomoderator+title%3Aoptions&restrict_sr=on&include_over_18=on&sort=new&t=all) Thursday, and [Fundamentals](https://www.reddit.com/r/stocks/search?q=author%3Aautomoderator+title%3Afundamentals&restrict_sr=on&include_over_18=on&sort=new&t=all) Friday."
Fintel - CLSK short interest,"Fintel Access

Does anyone have access to Fintel that could look up CLSK short interest details and post them on here?

It’s hard to find out a lot of information on short data here. Especially live. If someone could share some insight that would be helpful.

Or if someone has an alternative website for me to check out that’s cool too.


Cheers!"
"If a new product is brought to market, is it's value additive? Or does it always have to take from the market cap of another company?","For instance, with AI. Is the market stuck with the money thats in circulation? Or can the value of the new product add to the overall market value? I guess another way to ask is Does VT increase when there's an IPO? Sorry if this is a dumb question, still learning and I felt this might be too specific for the wiki"
"OK, Here is the main reason that why Biotech companies don't make money in China","My original post here [Why is NVO willing to sell drugs at such low price in China? : r/stocks](https://www.reddit.com/r/stocks/comments/1gwsahb/why_is_nvo_willing_to_sell_drugs_at_such_low/)
Even NVO facing IP challenges that some local biotech using the patent and China rules not favor NVO. 

  
Anyway, After spoke with one my friends, who works as a data scientists in BlackRock  focusing on analyze Biotech and Pharma. She told me the institutions don't really model Chinese market since these Pharma companies don't get much profit. She said the main reason is that, China leveraging its role as a ""developing country"" and medicine to developing countries should be cheap enough as part of humanitarianism.

  
Here is one example of Covid-19 [Pfizer slashed price of Paxlovid, but China wouldn't take it: industry insider – Radio Free Asia](https://www.rfa.org/english/news/china/covid-paxlovid-price-01132023122036.html)

  
where China pressure Pfizer to sell them Paxlovid at the price so cheap that even lower than  **El Salvador**

In NVO weight loss medicine, it should be domestic pharmacy making cheap generic locally ( as mentioned in earlier post) "
Intuit shares drop as quarterly forecast misses estimates due to delayed revenue,"Intuit shares fell 6% in extended trading Thursday after the finance software maker issued a revenue forecast for the current quarter that trailed analysts’ estimates due to some sales being delayed.

Here’s how the company performed in comparison with LSEG consensus:

Earnings per share: $2.50 adjusted vs. $2.35 expected

Revenue: $3.28 billion vs. $3.14 billion

Revenue increased 10% year over year in the quarter, which ended Oct. 31, according to a statement. Net income fell to $197 million, or 70 cents per share, from $241 million, or 85 cents per share, a year ago.

While results for the fiscal first quarter topped estimates, second-quarter guidance was light. Intuit said it anticipates a single-digit decline in revenue from the consumer segment because of promotional changes for the TurboTax desktop software in retail environments. While that will affect revenue timing, it won’t have any impact on the full 2025 fiscal year.

Intuit called for second-quarter earnings of $2.55 to $2.61 per share, with $3.81 billion to $3.85 billion in revenue. The consensus from LSEG was $3.20 per share and $3.87 billion in revenue.

For the full year, Intuit expects $19.16 to $19.36 in adjusted earnings per share on $18.16 billion to $18.35 billion in revenue. That implies revenue growth of between 12% and 13%. Analysts polled by LSEG were looking for $19.33 in adjusted earnings per share and $18.26 billion in revenue.

Revenue from Intuit’s global business solutions group came in at $2.5 billion in the first quarter. The figure was up 9% and in line with estimates, according to StreetAccount. Formerly known as the small business and self-employed segment, the group includes Mailchimp, QuickBooks, small business financing and merchant payment processing.

“We are seeing good progress serving mid-market customers in MailChimp, but are seeing higher churn from smaller customers,” Sandeep Aujla, Intuit’s finance chief, said on a conference call with analysts. “We are addressing this by making product enhancements and driving feature discoverability and adoption to improve first-time use and customer retention.”

Better outcomes are a few quarters away, Aujla said.

CreditKarma revenue came in at $524 million, above StreetAccount’s $430 million consensus.

At Thursday’s close, Intuit shares were up about 9% so far in 2024, while the S&P 500 has gained almost 25% in the same period.

On Tuesday Intuit shares slipped 5% after The Washington Post said President-elect Donald Trump’s proposed “Department of Government Efficiency” had discussed developing a mobile app for federal income tax filing. But a mobile app for submitting returns from Intuit is “already available to all Americans,” CEO Sasan Goodarzi told CNBC’s Jon Fortt.

Goodarzi said on CNBC that he’s personally communicating with leaders of the incoming presidential administration.

On the earnings call, Goodarzi sounded optimistic about the economy.

“Our belief, which is not baked into our guidance, is that we will see an improved environment as we look ahead in 2025, particularly just with some of the things that I mentioned earlier around just interest rates, jobs, the regulatory environment,” he said. “These things have a real burden on businesses. And we believe that a better future is to come.”

Source: https://www.cnbc.com/2024/11/21/intuit-intu-q1-earnings-report-2025.html"
