title,post
Ganja Bear Case (and one possible exception),"I think cannabis is an abysmally bad investment opportunity (with one exception) and almost no one knows why, because the precise nature of how THC as a drug operates isn't well understood by people who aren't both habitual consumers \*and\* up-to-date with knowledge on that sector this past decade or so.

It's the following issue: Let's say it's 2010 when cannabis is still illegal everywhere and I want to get high, I light up a single (1) joint with my friend, we smoke for 20 minutes, and then we're giggling. We go to buy some twice a month or so. A few years later it's been legalized and a ton of money floods into the space. Growers are all trying to compete with each other to take advantage of the laws changing, everyone wants to make stronger weed that gets you high more quickly than the other kinds, to draw customers to them, get market share and so on. ""Buy my iridescent purple galactic stardust reefer that gets you as high in one puff as 10x that amount of the neighboring place's stuff.""

This is a race to the bottom. Soon everyone is selling incredibly strong stuff, but you need \*far less\* of it to get the same high. Habitual users spend less than 10% of what they used to on weed now, everything is absurdly strong and cheap because of this competition. In addition you now have hash oil, edibles, dab pens, tinctures, you name it. Not just regular flower.

I never smoked much anyway, but in the rare case I want a mini-vacation now, I can take a vial of Tincture and put \*one drop\* under my tongue. Within two hours the world is spinning. It's so strong I never use it as anything other than a sleeping aid about once a month. A single bottle of this costs about $65, and it comfortably lasts me an entire year. This is a disaster for the industry because I almost never need to give them business. It's so strong that I rarely need to make a purchase at all. And no need for all the paraphernalia with it either. No vapes, pipes, lighters etc. The bottle comes with an eyedropper. Even if I use it often and develop a high tolerance, I still rarely need to go out for more. My friend and I have no reason to go smoke or spend much money on the supplies for it when for 1/100th the price we can get the same high now, assuming one of us has a tincture (or dab vape pen, or edible, or a newly exotic and potent strain) at home.

Compare this with alcohol, where you can't make, say, vodka much stronger than it is. It's impossible for me to come up with a 10x stronger vodka to put my competitors out of business because it's physically impossible for alcohol to exist at room temperature at concentrations higher than \~97% (I think), and vodka is already around 45% and can't reasonably go much higher (taste etc). Also there is a social nature to it that weed lacks, beer works more as a refreshment beverage like coke etc.

Or cigarettes, where even if you have a huge nicotine tolerance from constant Zyn use, the nature of the substance requires you to take it every couple hours to keep from getting jittery. You can't just get a year's supply of nicotine in a bottle because (first of all it'd be fatal with a slight dosage error) you need to have it in measured amounts you can take every 2-4 hours regardless of how much you're used to consuming, assuming you're dependent on it to begin with of course. And so it is a consistent business for sellers. This is most true of cigarettes, but also applies to vapes and pouches, which have similarly excellent profit margins. All of these a nicotine addict must consume regularly. Regulations also limit how much nicotine you can put in each product.

It is a subscription model, in short, while weed is equivalent to motor oil in terms of how often someone (a very heavy user to boot) has to go out and buy some, and how much they spend. Alcohol has some issues as well of lesser magnitude that I can go into elsewhere, but can lean on its usefulness in social situations whereas weed cannot.

The only exception to this? Turning Point Brands (TPB) stock, because they don't sell weed. They sell rolling papers and other paraphernalia for it. Which is indeed still a growing business if it gets legalized in more places and benefits from the greater proliferation of the stuff. Actual weed sellers do not, because the increased proliferation is offset by people needing to buy less of it for the same results due to increased THC concentration in the products. You can't sell 1/10th as much paper to people for the same effect, or at least it's less affected by this issue. The company also is wisely getting into nicotine pouches although this is very ambitious of them to compete with the tobacco majors directly on something. Not sure how that'll work out. Keep in mind this is a small cap company, less than $1 billion in market cap, reflecting how little profit there is to be made even on the periphery of this sector. But it's one small and thriving business I can find that has benefited from all this quite nicely. Not sure how much more it can grow, it's probably overvalued now, but in the past year or so it's risen strongly.

Otherwise? Cronos and other weed stocks? Bunk. For the birds. There might be an exception for medical marijuana (CBD) companies but that's pure conjecture as far as I know. You can make condensed CBD products just the same."
Anyone here long in Vertiv?,"Who remembers some odd story that circulated about Vertiv $VRT going to $50 over the summer? I was watching it closely and had bought several dips and made a quick 7-8 % on a few trades while I was testing the waters to go long. I started buying in the low 80s and bought all the way down to the lower $60s, but I stayed conservative with the rumor floating around that it would go to $50. I was planning to buy 200 shares but wound up with only 115 because of that damn rumor. Now I’m up 79% and I’m not buying more after such a parabolic move. I guess I’m just irritated after the rumor kept me from executing my full plan. "
Stock events this week,"Hello, I was wondering which event is bigger in terms of stock market volatility. Is it the FOMC minute on Tuesday (Nov.26) or PCE data on Wednesday (Nov.27)? I know it’s a short week and I wonder if the volume is going to be lower than usual, which might cause those event not as volatile? I’m only asking because I like to do a strangle on big event days, but I wasn’t sure which event would cause bigger volatility. Thank you"
MDA Space blowing up by year’s end (contract incoming),"All this hype with RKLB, LUNR, and RDW and no-one is mentioning MDA (mktcap - 3.2b CAD). Yeah I know it mainly trades on Toronto but just get a broker that supports Toronto, eg IBKR. They’re planning to list on US soon but by then it will probably already have taken off...

Their earnings report was stellar: growth of 38% yoy, it is actually **PROFITABLE** \- none of the other space companies are profitable - profitability with adjusted EBITDA of $55.5 million, up 30% YoY, and adjusted EBITDA margin of 19.7%, net income up 60% yoy, and net debt adjusted EBITDA ratio of just 0.8x (so zero risk of dilution). However, post earnings the stock was mostly flat. Why? Their reported backlog was unchanged from previous quarter report (backlog is 4.6B btw).

But if any of you folks had bothered to tune in to the call, you would have heard the CEO say that it is a fact that by year end they will be **definitely be signing a new contract worth 750M** – of these, only 300M is recorded in backlog – a**n additional $450M is going to be added** upon finalization and t**his will happen by year’s end.** They in fact stated during the Q&A that they are confident they will be finishing 2024 with $5B backlog. They also said MDA’s satellite systems division alone has a $**15B+ pipeline** of potential projects, thanks to its Aurora-class satellites tailored for low Earth orbit (LEO) constellations.

Still not convinced? Consider:

\> MDA is building a new 185,000 sq. ft. facility in Quebec, **capable of producing two satellites per day** starting in late 2025.

\>Planet labs is currently generating about 200million in revenue per year. MDA’s geointelligence segment is also generating about 200million in revenue per year. However, MDA’s geo segment represents **only about 20%** of MDA’s total revenue. PL’s marketcap is currently almost **1B**. MDA is 3.1 CAD = **2.2B USD**. Oh, and PL is currently operating at a loss (though that might change next report) but MDA is running a profit. Based on this fact alone, MDA’s mkt cap should be at least double than what it is.

 "
How are activist short sellers not committing insider trading,"It seems like they gain access to material non-public information, slowly build their case, then take a large short position before publishing all gathered information. How is that not insider trading?

I previously posted this question in r/Trading but nobody knew the answer and most people confused insider trading with being a company insider. I hope I have better luck here"
Speculate on GOOG - what'd be the best countermove against DoJ slaps? ,"For those who were sleeping/partying on the weekend, the following happened:

* DoJ said, Google should divest off Chrome and may not reenter the browser market for five years
* prohibited from ""acquiring any interests in search rivals, potential entrants, and rival search or search ads-related AI products""
* halt all ""anticompetitive payments to distributors, including Apple, Samsung"" so that Google isn't the default search engine on their devices
* content creators can choose to opt-out of Google crawlers to train its AI

Most obvious historical comparison is case against Microsoft Corp. in 2001; the DoJ tried to split Microsoft up due to its hold over the web browser market on Windows, though this case **ultimately resulted in a settlement**. With that in mind, it is possible, the DoJ will go this way, this time.

* Search is close to 50% revenue of Google \[Q3 results\]
* Browsers market shares: Chrome 60%, Safari 18%, Edge 8% \[Source can be contested, because it's larger devices stats only\]
* Android - 70% market share in handheld devices

GOOG has to fight hard to ensure a high search traffic. It may have a few options up its sleeves.



||||
|:-|:-|:-|
|""Chrome"" as a stand-alone listed company like Opera browser.|Possibly the worst move. Average user unlikely to install a browser-only app, than stick with factory default browser on the device. ||
|Chrome+Gemini as a new company, to command an ""AI"" valuation.|Not likely to attract advertisers, until this new 'app' gets wild Chat-GPT like popularity. ||
|Android+Chrome as a new company, provides operating system for device manufacturers|Won't make sense, because Samsung already has their prop. version of Android. And to gain search traffic, Google again needs to partner with this new company, which is prohibited.||
|A company with ""personal suite"" of applications, Gmail, Calendar, Docs and Chrome bundled together|Chrome then gets 100's million users from Day-1. Still, above legal prohibition remains. ||
|Settlement|Make it all go away!||

Any other speculations? With so much uncertainty, the stock will remain under pressure with downward bias, until there's clarity on the case.

But at PE 22, even if total revenue of the demerged companies, takes a hit of 30%, it's still a great value."
"Glancy Prongay & Murray LLP, a Leading Securities Fraud Law Firm, Announces Investigation of Match Group, Inc. (MTCH) on Behalf of Investors","[https://www.businesswire.com/news/home/20241115143239/en/Glancy-Prongay-Murray-LLP-a-Leading-Securities-Fraud-Law-Firm-Announces-Investigation-of-Match-Group-Inc.-MTCH-on-Behalf-of-Investors](https://www.businesswire.com/news/home/20241115143239/en/Glancy-Prongay-Murray-LLP-a-Leading-Securities-Fraud-Law-Firm-Announces-Investigation-of-Match-Group-Inc.-MTCH-on-Behalf-of-Investors)

Anyone know more about this? Obviously Match Group are incredibly dodgy, but they don't say exactly what fraud they have committed. "
Evaluation of Companies with Down Revenue,"I find this an interesting topic and am interested how others feel if a company would be considered potentially bullish with the following fundamentals.

- Cash flow per share growth (year over year)
- *Net profit margin growth (year over year)
- Lower long-term debt (year over year)

BUT ALSO HAS…

- Lower revenue (year over year)
- Lower net income (year over year)
- Lower earnings per share (year over year)

In my opinion when revenue (or net income) is declining, and not flat or increasing, it is a concern that the company could be on the brink of a big downturn. Especially in a continued pattern of these results.

However, I often see companies with these symptoms, (sometimes in different combinations but at least two of these are lower year over year), however the chart is very bullish at times…

Thoughts? (Thanks in advance for your opinion)

*Edit: Net profit margin growth vs typo of net income growth
"
Google stock thoughts ," think that google depends on Apple , if apple products fail, or if apple partner with another search engine then Google would fail

Edge and Bing are really good now , comes installed in 80% of the machines sold , if its good enough why bother downloading chrome ? and Bing looks almost exactly the same as google , 

Chrome Os is failing also, Android might get antitrust..  



What do you think? "
Delaware Funds by Macquarie,"Does anyone have any insight into Delaware Funds managed by Macquarie? 

Unfortunately, I was persuaded to purchase into one of the small / mid cap mutual funds in December 2020. Obviously the market was on a bit of a run there, but everything about the fund (historical build up, Morningstar ratings, length of existence of the fund, recommendations by publications, YoY performance,  etc) led me to believe it was a reasonable, if somewhat more aggressive, investment.  

It was all well and good for about a year, as the market rebounded from Covid and this particular fund hummed along with the rest of the economy.   Articles like [this in the mainstream press](https://www.marketwatch.com/story/4-stock-picks-for-the-post-pandemic-nesting-economy-from-a-five-star-money-manager-11636995166?mod=bnbh_mwarticle) lent further credence that the fund was solid and the fund managers respected by financial journalism. 

And then it did a capital gains distribution (historically very normal for this fund) in December 2021 and then the share price immediately started its plummet.  Like, overnight, lost $15/share.  Similarly, it went seemingly overnight from a Morningstar 5 rating to a 2 rating.  It continued to fall from there. 

  
I guess I am one of those silly buy and hold people.  I always assume that short term losses will eventually be made up in the long term.  Since then....no. 

  
Earlier this year, Delaware merged a couple of their funds, so DFDIX became IYMIX.   As far as I can tell, the holdings in IYMIX are not radically different than what DFDIX held.   In a market that has been turbo charged for the past year, the growths of this fund have been glacial.   I realize that the holdings are small / mid cap and those are ostensibly still being knocked around by high interest rates, but the three years since that initial freefall following the capital gains distribution has not really begun to make up the ground that the fund dramatically lost. 

I've literally never been in a mutual fund that actively lost money for me.  Plenty have not grown in dramatic ways, but actually halving of value?  That's never happened before. 

Does anyone have any insight into this investment company or explanation why a small / midcap fund would depreciate to such a dramatic extent and fail to recover over a period of years when stock market growth is explosive? 

  
I'm a little heartsick at the thought of just cutting losses and investing in Vanguard or something but it's been really stressful.  

Thanks in advance.  (And yes, I realize I should have been using trailing stops, but didn't, so no lectures there, please.)"
"r/Stocks Weekly Thread on Meme Stocks Saturday - Nov 23, 2024","The meme stock scheduled posts will now run weekly and post Saturday afternoon and won't be a sticky; you're probably seeing this because automod sent you here!

[Full list of meme stocks here.](https://www.reddit.com/r/stocks/wiki/meme-stocks)  This will be updated every once in a while.

------

Welcome traders who just can't help them selves discuss the same exact stock that's been discussed 100s of times a day.  I get it, you want to talk about what's popular, what's hot, and that 1.. single.. stock you like.. well here you go!  Some helpful links just for you:

* [Previous meme stock threads](https://www.reddit.com/r/stocks/search?q=author%3Aautomoderator+title%3A%28common+OR+meme%29&restrict_sr=on&include_over_18=on&sort=new&t=all)
* [General discussions](https://www.reddit.com/r/stocks/search?q=author%3Aautomoderator+title%3Adiscussion&restrict_sr=on&include_over_18=on&sort=new&t=all)
* [The **original GME megathread**](https://www.reddit.com/r/stocks/comments/layb68/rstocks_gme_megathread/) with a ton of useful information
* [Use Finviz for aggregated news on your favorite stock](https://finviz.com/quote.ashx?t=gme)

An important message from the mod team [regarding meme stocks.](https://www.reddit.com/r/stocks/wiki/meme-stocks-warning)

Lastly if you need professional help:

* Problem Gambling:  Call/Text: 1-800-522-4700 or [chat online now.](https://WWW.NCPGAMBLING.ORG/CHAT)
* Crisis Hotline (24/7): 1-800-273-TALK (8255) (Veterans, press 1) or Text “HOME” to 741-741"
Games Workshop up 15% following higher than expected quarterly sales!,"A few months ago I posted about Games Workshop and why I thought it was undervalued.  
TLDR: the new Space Marine II game was a hit and this would drive increased sales.

I posted about it here: [https://www.reddit.com/r/stocks/comments/1g6lt1l/games\_workshop\_hold\_or\_sell/](https://www.reddit.com/r/stocks/comments/1g6lt1l/games_workshop_hold_or_sell/)  
In the end, I decided to hold (thank God!)

Today GW announced significantly higher-than-expected quarterly sales, resulting in a 15% bump in stock price.

My hope is that this also makes an Amazon show deal more likely. This is clearly a popular and valuable IP and hopefully, this news will help get a deal over the line with Amazon.

I'm not sure if the stock is now fairly priced or still a little under-priced. I'd appreciate any community thoughts on this!

But I do think this is a super cool stock worth taking a look at :)"
Anyone knows which website is showing stocks performance in many green tiles and red tiles?,"I recall coming across a website that visually represented stock performance using a grid of green and red tiles. The green tiles indicated stocks performing well, while the red tiles showed those that were declining. It was an intuitive and straightforward way to see the overall market trend at a glance. However, I can't remember the name of the website or where I saw it. If anyone is familiar with a site that uses this type of visual representation for stocks, please let me know. It was really helpful for quick analysis!"
"/r/Stocks Weekend Discussion Saturday - Nov 23, 2024","This is the weekend edition of our stickied discussion thread.  Discuss your trades / moves from last week and what you're planning on doing for the week ahead.

Some helpful links:

* [Finviz](https://finviz.com/quote.ashx?t=spy) for charts, fundamentals, and aggregated news on individual stocks
* [Bloomberg market news](https://www.bloomberg.com/markets)
* StreetInsider news:
  * [Market Check](https://www.streetinsider.com/Market+Check) - Possibly why the market is doing what it's doing including sudden spikes/dips
  * [Reuters aggregated](https://www.streetinsider.com/Reuters) - Global news

If you have a basic question, for example ""what is EPS,"" then google ""investopedia EPS"" and click the investopedia article on it; do this for everything until you have a more in depth question or just want to share what you learned.

Please discuss your portfolios in the [Rate My Portfolio sticky.](https://www.reddit.com/r/stocks/search?q=author%3Aautomoderator+title%3A%22Rate+My+Portfolio%22&restrict_sr=on&sort=new&t=all).

See our past [daily discussions here.](https://www.reddit.com/r/stocks/search?q=author%3Aautomoderator+%22r%2Fstocks+daily+discussion%22&restrict_sr=on&sort=new&t=all)  Also links for:  [Technicals](https://www.reddit.com/r/stocks/search?q=author%3Aautomoderator+title%3Atechnicals&restrict_sr=on&include_over_18=on&sort=new&t=all) Tuesday, [Options Trading](https://www.reddit.com/r/stocks/search?q=author%3Aautomoderator+title%3Aoptions&restrict_sr=on&include_over_18=on&sort=new&t=all) Thursday, and [Fundamentals](https://www.reddit.com/r/stocks/search?q=author%3Aautomoderator+title%3Afundamentals&restrict_sr=on&include_over_18=on&sort=new&t=all) Friday."
AMD: The $145 Recovery Rally is Coming Next Week,"**The Why**

* **Earnings beat** revenue expectations with $6.82B (+18% YoY) and EPS of .92 (+31% YoY and spot on with projection) 
* Data center revenue surged **+122%**, proving AMD is gaining AI momentum.
* Recent selloff (-$30/share) was a **market overreaction** to slightly soft Q4 guidance.
* The market shifted focus to NVIDIA's upcoming earnings stalling an AMD rally.
* **Catalysts**: Workforce optimization, IBM partnership, and AI-focused leadership changes.

# The Setup

AMD is streamlining its org for an **AI-dominated future**:

1. **Reduction in Force**: Cutting 4% of workforce to focus on AI chip development.
2. **New Leadership**: CFO transition positions AMD for its next growth phase.
3. **IBM Partnership**: MI300X accelerators are now a key piece of IBM Cloud’s AI stack.

# The Target

With analysts targeting **$160-$180** and the market ready to refocus on AMD’s strengths, **$145+ next week is on the table**. This dip is a gift. The rally is coming. Get ready!"
Anyone else concerned with this rally?,"I've been super happy since September to see my portfolio take off. I own stocks such as reddit, shopify, square & sofi which all have had fabulous runups in a short span.

Although I'm long on these names I'm seriously considering selling some or all of my shares and tossing it into a etf or nice slow growing dividend stock like mcdonalds or abbvie. 

I've been through this rodeo before where the market blasts off in a short window to just wreck my account.  Basically 2020-2021 and then all of 2022.

If I sell I'm looking at a larger tax bill but it only means I made money afterall.

I'm looking for advise, do you think its wise to start to take some off the table or have you started to sell?
"
