title,post
SMCI potential in the coming weeks/months,"I am pretty new to investing as a whole and have seen a lot of hype around SMCI. With the accounting troubles etc. that they currently face, which has lead to the significant fall in price, what are the actual chances that the company gets delisted? Is this a risk worth putting a good amount of money into?"
Question about selling and purchase again in less than 30 days Taxes. ,"Hello, I have a question. If I buy 1,000 shares of XYZ at $10 and then sell them for $6, can I use the $4,000 loss for tax purposes
But if the stock continues to fall and before 30 days have passed since I sold it, I buy it again at $4 per share and after a while I sell it at $7??

How count this??? Loss $4000, Gain $3000 = -$1000

What would happen in that case? And if instead of selling it at $7, I hold it longer and end up selling it for more than the $10 I originally paid?

Thanks and sorry my English. "
Is there a realistic scenario where you would sell all your stocks? ,"To be 100% clear, I'm not talking about an Armageddon scenario (Total nuclear war, extinction level meteor etc). 

For me, the only situation I can think of that would have me hitting the sell button would be a Chinese invasion of Taiwan. This would likely bring us into world war 3, especially if it happens in the next 5 years. 

Any other realistic scenarios that would have you hitting sell? "
"TSMC seems cheap to me, what’s your opinion?","
Key stats today: Forward P/E 17.6x, PEG 0.6x, P/FCF 23.7x, EV/EBITDA 10.1x, Consensus target price $1390.43 compared to current price of $1005.00, Implied upside 38.4%. (source Factset as of 11/27/2024)

Investment thesis: The surge in AI applications has significantly increased demand for TSMC’s advanced chips. In Q3 2024, net profit rose 54% year-over-year to NT$325.3 billion (US$10.1 billion), exceeding forecasts. AI-related products are expected to contribute 15% of TSMC’s revenue in 2024, up from 5% in 2023. TSMC plans to commence mass production of 2-nanometer chips in Taiwan by 2025, maintaining its competitive edge. 
TSMC is diversifying its manufacturing footprint with significant investments in the U.S. and Japan. In Arizona, TSMC is constructing fabs expected to begin production between 2025 and the decade’s end. In Japan, TSMC, in partnership with Sony, opened a chip plant in February 2024 and plans a second facility by 2027.
"
Could Coinbase enter the S&P 500 in the Dec Rebalance? What do you think!,"[Coinbase](https://www.coinbase.com/) Global Inc. (COIN) has demonstrated significant growth, meeting several key benchmarks considered by the S&P 500 Index Committee. However, its performance is closely tied to the cryptocurrency market, particularly Bitcoin. This correlation is evident, as Coinbase's stock price often mirrors Bitcoin's fluctuations. For instance, during bullish Bitcoin trends, Coinbase experiences increased trading volumes and revenues, leading to higher stock valuations. Out off all the likely companies [Coinbase](https://www.coinbase.com/) is in my top 3 for inclusion this Rebalance.  
  
The forthcoming S&P 500 rebalance will indeed be indicative of the Index Committee's perspective on integrating companies like Coinbase, which are deeply embedded in the cryptocurrency sector. Inclusion of such a company would signal a significant shift towards embracing the evolving financial landscape and acknowledging the growing prominence of digital assets. Conversely, opting not to include Coinbase might suggest a more cautious approach, reflecting concerns about the inherent volatility and regulatory uncertainties associated with the crypto market. Therefore, the committee's decision will not only impact Coinbase but also serve as a broader statement on the acceptance of digital asset platforms within traditional financial indices.

[TradingView](https://www.tradingview.com/chart/BTCUSDT/fiO01sTb-Dynamic-Relationship-Between-Bitcoin-and-Coinbase/?utm_source=chatgpt.com)

The S&P 500 Index Committee employs specific criteria for inclusion, such as market capitalisation, liquidity, domicile, public float, and financial viability. While Coinbase may satisfy these quantitative measures, the committee also exercises qualitative judgment, considering factors like market stability and the company's role within its industry.

[Corporate Finance Institute](https://corporatefinanceinstitute.com/resources/equities/sp-500-index/?utm_source=chatgpt.com)

Given Coinbase's substantial exposure to the volatile cryptocurrency market, the committee might deliberate on the potential risks associated with such volatility. The decision to include a company so intertwined with the crypto sector would reflect the committee's stance on the evolving financial landscape and its readiness to integrate digital asset platforms into traditional indices.

In summary, while Coinbase appears to meet the fundamental requirements for S&P 500 inclusion, its strong correlation with Bitcoin introduces considerations that the committee will likely scrutinise, balancing traditional financial principles with the dynamic nature of the cryptocurrency market."
I think bird flu risk is being underestimated by the market. Long on $MRNA,"So far H5N1 has been slowly making it’s way from chickens to cows (around the middle of 2024) and now pigs in Oregon (within the last couple weeks). There have been a few mild human cases, basically all in farm workers working closely with infected animals. Although there was at least one case recently where they had no idea where the patient got infected from.

Normally, CDC will be tracking all this and keeping tabs on isolation of infected communities/individuals. This flu seems to be most prevalent in the US than other countries so far, and we have much more transparency and observability than China. So my risk assessment for this has been pretty low until Trump got elected.

But Trump has been making it very very clear that he’s going to pull every stop to deport undocumented migrants. Most of the people working in shitty conditions in farms are…undocumented. Undocumented workers are normally able to access some level of public services like healthcare, but this is about to get completely shut down by the Trump admin. And these farm workers are about to get shoved into concentrated compartments with really poor hygiene conditions, and it’s going to take a long time for them to actually get processed and deported. Many will run and hide, and that will also end up hiding how many people are actually infected and spreading the disease.

I think most people are expecting the Trump admin, especially under RFK Jr.'s health dept, to reduce spending on vaccines. But I think at a certain point, the rhetoric is bound to change, as more and more people get bird flu. After all, Operation Warp Speed was under the last Trump administration as well.

Moderna was given $176 million in July by the HHS to develop an mRNA bird flu vaccine. There already exists a bird flu vaccine made by CSL Seqirus, but I would imagine that the Trump administration will want to call upon a well-known American company to manufacture ""America first"" vaccines.

$MRNA has been down for many months, as the COVID hype worn down, but they [recently announced](https://www.biospace.com/business/moderna-slashes-r-d-budget-by-1-1b-eyes-10-approvals-through-2027) that they are reducing R&D expenses and focusing on 10 approvals by 2027. They've also been making huge jumps in the last week due to a [bullish sales view](https://www.investopedia.com/moderna-stock-jumps-following-bullish-sales-view-at-healthcare-conference-8750059). I'm long on $MRNA."
Reddit overtakes X in popularity of social media platforms in UK $RDDT,"[https://www.theguardian.com/technology/2024/nov/28/reddit-overtakes-x-in-popularity-of-social-media-platforms-in-uk](https://www.theguardian.com/technology/2024/nov/28/reddit-overtakes-x-in-popularity-of-social-media-platforms-in-uk)

Reddit, the American online discussion platform, has overtaken X to become the fifth most popular social media platform in the UK, according to the communications watchdog.

Ofcom said Reddit, where users post on discussion threads within topic-based communities, was visited by 22.9 million UK adults in May this year, compared with 22.1 million on X.

The figures make Reddit the fastest-growing large social media platform in the UK and represent a growth of 47% on the same period in 2023. The leap took Reddit above LinkedIn and X into fifth place on the table of UK social media platforms, which is now topped by YouTube after it overtook [Facebook](https://www.theguardian.com/technology/facebook), reaching more than 44 million adults.

Reddit, renowned for its devoted user base who refer to one another as Redditors, appears to have been boosted by updates to Google’s search engine this year.

Farhad Divecha, the managing director of the UK-based digital marketing agency AccuraCast, said: “Google’s latest algorithm update in the first half of 2024 gave Reddit a big boost in organic search traffic. I think that has probably contributed a lot.”

Ofcom also speculated that the change may have been caused [by alterations to how third-party apps accessed its content](https://www.theguardian.com/technology/2023/jun/14/reddit-moderators-vow-to-continue-blackout-in-api-access-fees-row), forcing users of those apps to switch to the Reddit site. The watchdog also flagged publicity around Reddit’s stock market flotation in March this year.

The popularity of X also fell over the same period, according to Ofcom, with its reach falling by 8% since May last year. X has been criticised over content moderation standards since its [takeover by Elon Musk in 2022](https://www.theguardian.com/technology/2022/oct/28/elon-musk-twitter-hate-speech-concerns-stock-exchange-deal) but it has also faced competition since July 2023 from Threads, a rival to X [launched by Mark Zuckerberg’s Meta](https://www.theguardian.com/technology/2023/jul/06/meta-launches-twitter-rival-threads-in-100-countries).

The Ofcom figures featured in the watchdog’s annual report into the nation’s digital habits, which revealed that four out of 10 UK adults say they have encountered misinformation or deepfakes, with the majority of those cases occurring online.

The misinformation survey, based on a poll of more than 4,000 UK adults, also found that three in 10 adults believe there is a single group of people who control the world together, with the same number believing there is “significant evidence” of electoral fraud in the UK.

The regulator also found that one-third of UK adults are not confident in judging whether an image or a piece of audio or video has been created by artificial intelligence."
PayPal: A Path Back to Its Historical Strength and Growth Potential,"PayPal, once a darling of the fintech space, has seen its valuation contract significantly over the past few years. With its price-to-earnings (P/E) ratio currently hovering around 20, the stock is far below its historical average of 43. A return to that average, driven by projected earnings of $5.71 per share by 2025, would imply a stock price north of $246—an opportunity that many investors might be overlooking. But for PayPal to reclaim its historical valuation, much must fall into place.

The foundation of PayPal’s future lies in its strategic initiatives, beginning with the integration of its U.S. dollar-backed stablecoin, PayPal USD (PYUSD). Introduced in 2023, PYUSD is more than just another digital currency; it is PayPal’s bridge to the future of blockchain-powered commerce. Unlike many failed stablecoin experiments, PYUSD is fully backed by U.S. dollar deposits and Treasuries, giving it the stability and trustworthiness needed to thrive. The potential for PYUSD to facilitate global cross-border payments and power decentralized finance (DeFi) applications is immense. PayPal’s ability to capitalize on this innovation could redefine its relevance in the financial ecosystem.

Beyond cryptocurrency, PayPal is making waves with a growing advertising business that has largely flown under the radar. By leveraging its immense trove of transactional data from over 400 million active users, the company is building a platform that allows merchants to create highly targeted and effective marketing campaigns. This advertising arm, though still in its early stages, has the potential to generate billions in annual revenue. Even modest success here could have a significant impact on PayPal’s top line, creating another compelling growth driver.

Innovation has always been at the heart of PayPal’s strategy, and recent developments like the Fastlane checkout system showcase its commitment to staying ahead. This one-click guest checkout feature, paired with partnerships with major platforms like Shopify and Fiserv, enhances the company’s offerings for merchants and consumers alike. Meanwhile, initiatives like the CashPass rewards program deepen user engagement and loyalty, ensuring that PayPal remains a go-to solution for everyday transactions.

Leadership will play a critical role in PayPal’s resurgence, and newly appointed CEO Alex Chriss appears well-suited for the task. With a proven track record at Intuit, Chriss has demonstrated his ability to foster innovation and deliver results. His focus on empowering small businesses aligns perfectly with PayPal’s strengths and provides a roadmap for future growth.

But the journey back to a P/E of 43 will require more than just strategic initiatives and innovation. PayPal needs to rebuild investor confidence. The company must consistently deliver strong earnings, improve operational efficiencies, and effectively communicate its vision to the market. Transparent updates on key growth areas—such as PYUSD adoption, advertising revenue, and merchant partnerships—will be crucial in shaping the market’s perception of PayPal’s potential.

A return to PayPal’s historical valuation isn’t just about numbers; it’s about the story the company tells and the trust it rebuilds with investors. If PayPal can execute on its strategy, the potential reward is not just a higher stock price but a reaffirmation of its position as a leader in the fintech space. For those willing to look beyond the current market sentiment, PayPal’s path to $246 offers a compelling narrative of transformation, growth, and untapped opportunity.

TL;DR: PayPal is undervalued at a P/E of 20 compared to its historical average of 43. To return to its peak valuation, it must capitalize on its stablecoin (PYUSD), grow its new advertising business, and leverage innovative products like Fastlane Checkout. Under CEO Alex Chriss, with strategic execution and strong earnings, PayPal could see a stock price of $246 by 2025, reaffirming its leadership in fintech.
"
"r/Stocks Daily Discussion & Options Trading Thursday - Nov 28, 2024","This is the daily discussion, so anything stocks related is fine, but the theme for today is on stock options, but if options aren't your thing then just ignore the theme.

Some helpful day to day links, including news:

* [Finviz](https://finviz.com/quote.ashx?t=spy) for charts, fundamentals, and aggregated news on individual stocks
* [Bloomberg market news](https://www.bloomberg.com/markets)
* StreetInsider news:
  * [Market Check](https://www.streetinsider.com/Market+Check) - Possibly why the market is doing what it's doing including sudden spikes/dips
  * [Reuters aggregated](https://www.streetinsider.com/Reuters) - Global news

-----

Required info to start understanding options:

* [Call option Investopedia video](https://www.investopedia.com/terms/c/calloption.asp) basically a call option allows you to buy 100 shares of a stock at a certain price (strike price), but without the obligation to buy
* [Put option Investopedia video](https://www.investopedia.com/terms/p/putoption.asp) a put option allows you to sell 100 shares of a stock at a certain price (strike price), but without the obligation to sell
* Writing options switches the obligation to you and you'll be forced to buy someone else's shares (writing puts) or sell your shares (writing calls)

See the following word cloud and click through for the wiki:

[Call option - Put option - Exercising an option - Strike price - ITM - OTM - ATM - Long options - Short options - Combo - Debit - Credit or Premium - Covered call - Naked - Debit call spread - Credit call spread - Strangle - Iron condor - Vertical debit spreads - Iron Fly](https://www.reddit.com/r/stocks/wiki/options-themed-post)

If you have a basic question, for example ""what is delta,"" then google ""investopedia delta"" and click the investopedia article on it; do this for everything until you have a more in depth question or just want to share what you learned.

See our past [daily discussions here.](https://www.reddit.com/r/stocks/search?q=author%3Aautomoderator+%22r%2Fstocks+daily+discussion%22&restrict_sr=on&sort=new&t=all)  Also links for:  [Technicals](https://www.reddit.com/r/stocks/search?q=author%3Aautomoderator+title%3Atechnicals&restrict_sr=on&include_over_18=on&sort=new&t=all) Tuesday, [Options Trading](https://www.reddit.com/r/stocks/search?q=author%3Aautomoderator+title%3Aoptions&restrict_sr=on&include_over_18=on&sort=new&t=all) Thursday, and [Fundamentals](https://www.reddit.com/r/stocks/search?q=author%3Aautomoderator+title%3Afundamentals&restrict_sr=on&include_over_18=on&sort=new&t=all) Friday."
"Google, Apple, and Microsoft are facing anti trust threats ","At some point do these companies momentum of growing free cash flow exponentially slow down with the looming regulatory attacks? 

I’m hedging with Berkshire Hathaway, but I wonder how everyone else protects their portfolios? "
Intel stock a viable investment now that it has a government contract for chips?,"What are our thoughts on Intel? It’s a company that I understand has had financial troubles, but the government contract that it has may help it bounce back. What does everyone think? Do we think it’s a buy or a goodbye?"
Microsoft faces wide-ranging U.S. antitrust probe,"The U.S. Federal Trade Commission has opened a broad antitrust investigation into Microsoft, including of its software licensing and cloud computing businesses, a source familiar with the matter said on Wednesday.

The probe was approved by FTC Chair Lina Khan ahead of her likely departure in January. The election of Donald Trump as U.S. president, and the expectation he will appoint a fellow Republican with a softer approach toward business, leaves the outcome of the investigation up in the air.  
  
The FTC is examining allegations the software giant is potentially abusing its market power in productivity software by imposing punitive licensing terms to prevent customers from moving their data from its Azure cloud service to other competitive platforms, sources confirmed earlier this month.  
  
The FTC is also looking at practices related to cybersecurity and artificial intelligence products, the source said on Wednesday.

Microsoft declined to comment on Wednesday.  
  
The FTC fielded complaints about Microsoft last year as it examined the cloud computing market.

NetChoice, a lobbying group that represents online companies including Amazon and Google, which compete with Microsoft in cloud computing, criticized Microsoft’s licensing policies, and its integration of AI tools into its Office and Outlook.

“Given that Microsoft is the world’s largest software company, dominating in productivity and operating systems software, the scale and consequences of its licensing decisions are extraordinary,” the group said.  
The FTC has demanded a broad range of detailed information from Microsoft, Bloomberg reported earlier on Wednesday.  
  
Until now, Microsoft has been somewhat of an exception to U.S. antitrust regulators’ recent campaign against allegedly anticompetitive practices at Big Tech companies.  
  
Facebook owner Meta Platforms, Apple, and Amazon.com Inc. have all been accused by the U.S. of unlawfully maintaining monopolies.  
  
Alphabet’s Google is facing two lawsuits, including one where a judge found it unlawfully thwarted competition among online search engines.  
  
Microsoft CEO Satya Nadella testified at Google’s trial, saying the search giant was using exclusive deals with publishers to lock up content used to train artificial intelligence.  
  
It is unclear whether Trump will ease up on Big Tech, whose first administration launched several Big Tech probes. JD Vance, the incoming vice president, has expressed concern about the power the companies wield over public discourse.  
  
Still, Microsoft has benefited from Trump policies in the past.  
  
In 2019, the Pentagon awarded it a $10 billion cloud computing contract that Amazon had widely been expected to win. Amazon later alleged that Trump exerted improper pressure on military officials to steer the contract away from its Amazon Web Services unit.

Source: [https://www.cnbc.com/2024/11/27/microsoft-faces-wide-ranging-us-antitrust-probe.html](https://www.cnbc.com/2024/11/27/microsoft-faces-wide-ranging-us-antitrust-probe.html)"
EC Stock - Value opportunity,"Hey all,

I think I'm gonna open a position on EC, it's got a P/E ratio of 4.58, it's at a close-to historic low, and I think the fundamentals are there. It's got good cash albeit with some debt, it's subsizdized by the columbian government and provides 3% of their total GDP. Gustav Petro is a leftist president but he has a right-leaning congress and likely won't impact the company any more than he already has, he's also pretty unpopular and will likely be voted out in 2026. I acknowledge it has worse margins than Petrobras per barrel, but it is still profitable with strong revenue. Curious if anyone else was thinking about making a similar move or had different perspectives on the stock."
"PCE rises to 2.3% annually, ""meeting expectations""","I'm surprised the market has been taking this in stride. Although this data is ""meeting expectations"", it does paint a picture of sticky inflation and with the incoming tariffs why isn't the market more negative? Are people just out of office already?

via [MSNBC](https://www.cnbc.com/2024/11/27/pce-inflation-october-2024.html):

* The personal consumption expenditures price index increased 0.2% on the month and showed a 12-month inflation rate of 2.3%, both in line with expectations.
* Core inflation showed even stronger readings, with an increase at 0.3% on a monthly basis and an annual reading of 2.8%, also as forecast.
* Spending rose 0.4% on the month, as forecast, while personal income jumped 0.6%, well above the 0.3% estimate.
* Despite the rise in headline inflation, traders increased their bets that the Fed would approve another rate cut in December. Odds of a quarter-percentage-point reduction in the central bank’s key borrowing rate were at 66% Wednesday morning, according to the CME Group’s FedWatch measure.
* Consumer spending was still solid in October, though it tailed off a bit from September. Current-dollar expenditures rose 0.4% on the month, as forecast, while personal income jumped 0.6%, well above the 0.3% estimate, the report showed.
* The personal saving rate slipped to 4.4%, tied for its lowest since January 2023.
* On the inflation side, housing-related costs have continued to boost the numbers, despite expectations that the pace would cool as rents eased. Housing prices rose 0.4% in October."
If you could only buy one stock now what would it be,"
I have $2000 to invest. I’m stupid when it comes to stocks and just listen to random strangers on Reddit. Only did it a couple times and 5x my money both times. Now I’m here again. Give me one stock that you would go all in on today and sell within 1-3 years. It doesn’t have to do crazy numbers, but one you have a strong chance of doing at least 2x and little chance of it losing money.

Edit: going all in on 4 you guys mentioned. Let’s get this mf bag!!"
